{
  "schema_version": 1,
  "evidence_kind": "successful_child_handoff_cleanup",
  "run_marker": "qualification-whole-spec-v1-20260921-handofffix",
  "scenario": "whole-spec-v1",
  "backend": "thread",
  "fixture_status": "contract_example",
  "scope": {
    "repository": "williamxhero/skills",
    "spec_issue": 150,
    "ticket_issues": [155, 156, 157]
  },
  "parent_continuation": {
    "turn_status": "completed",
    "persisted_output_count": 0,
    "persisted_item_count": 0,
    "classified_as_uncertain": true
  },
  "external_effect_reconciliation": {
    "github_effects_read_back": true,
    "pull_request_effects_read_back": true,
    "evidence_refs": [
      "https://github.com/williamxhero/skills/issues/150",
      "https://github.com/williamxhero/skills/issues/155",
      "https://github.com/williamxhero/skills/issues/156",
      "https://github.com/williamxhero/skills/issues/157"
    ]
  },
  "controller_action": {
    "pending_action_reconciled": true,
    "persisted_status": "succeeded",
    "evidence_refs": [
      "qualification://successful-child-handoff/spec-2/pending-action/readback"
    ]
  },
  "child_cleanup": {
    "archive_requested": true,
    "archive_readback": true,
    "evidence_refs": [
      "qualification://successful-child-handoff/spec-2/archive/request",
      "qualification://successful-child-handoff/spec-2/archive/readback"
    ]
  },
  "successor_gate": {
    "child_archive_verified_before_next_spec": true,
    "next_spec_started": false
  }
}
